{
  "$schema": "https://json-schema.org/draft/2020-12/schema",
  "$id": "https://jp.systems/schemas/revenue/fardarter-drive-production-reconciliation-v6-12.schema.json",
  "title": "Fardarter Drive v6.12 Production Reconciliation",
  "type": "object",
  "additionalProperties": false,
  "required": [
    "controlId",
    "controllerVersion",
    "controllingIssue",
    "repository",
    "verifiedProduction",
    "rollbackAnchor",
    "stateClassification",
    "truthDistinctions",
    "futurePromotionGate",
    "canonicalBoundaries",
    "actualEffects",
    "manifestDigest"
  ],
  "properties": {
    "controlId": { "const": "FARDARTER-DRIVE-PRODUCTION-RECONCILIATION-V6-12" },
    "controllerVersion": { "const": "6.12.0" },
    "controllingIssue": { "const": 195 },
    "repository": {
      "type": "object",
      "additionalProperties": false,
      "required": [
        "reconciliationBaseHead",
        "deployedApplicationSource",
        "deploymentControlMerge",
        "currentMainAtCreation",
        "currentMainContainsControlOnlyAfterDeployedSource"
      ],
      "properties": {
        "reconciliationBaseHead": { "const": "f5d3261bb513764fe14601ef9d0fc53e71ea83b3" },
        "deployedApplicationSource": { "const": "88bd8dc89a0bd95f42c7e1a21dccc56fe9dc7334" },
        "deploymentControlMerge": { "const": "f5d3261bb513764fe14601ef9d0fc53e71ea83b3" },
        "currentMainAtCreation": { "const": "f5d3261bb513764fe14601ef9d0fc53e71ea83b3" },
        "currentMainContainsControlOnlyAfterDeployedSource": { "const": true }
      }
    },
    "verifiedProduction": {
      "type": "object",
      "additionalProperties": false,
      "required": [
        "provider",
        "siteId",
        "siteName",
        "deployId",
        "immutableUrl",
        "providerState",
        "providerUploadRunId",
        "recoveryVerificationRunId",
        "readbackContractVersion",
        "requiredRouteCount",
        "verifiedRouteCount",
        "exactBodyMatchCount",
        "staticPackageSha256",
        "evidenceSha256",
        "artifactName",
        "artifactId",
        "artifactDigest",
        "materializationMode",
        "runtimeFunctionsRequiredForVerifiedRoutes",
        "verificationState"
      ],
      "properties": {
        "provider": { "const": "NETLIFY" },
        "siteId": { "const": "21d3bb41-3a69-4a7d-b6c6-e873cde8ee2f" },
        "siteName": { "const": "lichburn-v0-2-8" },
        "deployId": { "const": "6a6ba0366ebec6650d843ac3" },
        "immutableUrl": { "const": "https://6a6ba0366ebec6650d843ac3--lichburn-v0-2-8.netlify.app" },
        "providerState": { "const": "READY" },
        "providerUploadRunId": { "const": 30572898948 },
        "recoveryVerificationRunId": { "const": 30573526190 },
        "readbackContractVersion": { "const": "6.11.0" },
        "requiredRouteCount": { "const": 18 },
        "verifiedRouteCount": { "const": 18 },
        "exactBodyMatchCount": { "const": 18 },
        "staticPackageSha256": { "const": "d8a876dfc9b5156bef118fae6487c18358c884d4aa326235286152e38dddb104" },
        "evidenceSha256": { "const": "d0a5f072f7b6dd544f47eeba28c93461aeab2ccb9cedd85b00ead83d19eb23ee" },
        "artifactName": { "const": "fardarter-v6-11-deployed-and-verified-30573526190" },
        "artifactId": { "const": 8771747385 },
        "artifactDigest": { "const": "sha256:009217308c48b1cfbc4cc00ab46f2b9199d72617ff1ed32dc8b367f29785a981" },
        "materializationMode": { "const": "NETLIFY_V1_ROUTE_BLOBS_PLUS_FROZEN_DYNAMIC_RESPONSES_TO_STATIC_PACKAGE" },
        "runtimeFunctionsRequiredForVerifiedRoutes": { "const": false },
        "verificationState": { "const": "DEPLOYED_AND_VERIFIED" }
      }
    },
    "rollbackAnchor": { "type": "object" },
    "stateClassification": { "type": "object" },
    "truthDistinctions": { "type": "object" },
    "futurePromotionGate": { "type": "object" },
    "canonicalBoundaries": { "type": "object" },
    "actualEffects": { "type": "object" },
    "manifestDigest": { "const": "1e8aa2af8bb3af332185b7419c63e2c1ad8c19c866e45b62fe04a2fc969932ee" }
  }
}
